{
  "slug": "kai-voss-001",
  "title": "Dusk Amber II",
  "description": "Two luminous color fields meet at an uncertain horizon, oil on linen.",
  "artistSlug": "kai-voss",
  "imageUrl": "/images/pieces/dusk-amber-ii.png",
  "editionSize": 15,
  "editionsSold": 8,
  "reservedCount": 0,
  "availabilityStatus": "available",
  "priceCents": 29900,
  "currency": "USD",
  "tags": ["abstract", "minimalist", "earth tones", "color field"]
}
