{
  "slug": "kai-voss-003",
  "title": "Empty Mountain",
  "description": "Vast silence rendered in layered washes of grey and white on linen canvas.",
  "artistSlug": "kai-voss",
  "imageUrl": "/images/pieces/empty-mountain.svg",
  "editionSize": 5,
  "editionsSold": 5,
  "reservedCount": 0,
  "availabilityStatus": "sold-out",
  "priceCents": 39900,
  "currency": "USD",
  "tags": ["abstract", "monochrome"]
}
